{
  "allow_replan": false,
  "allow_success_after_replan": false,
  "allow_success_after_retry": false,
  "allowed_strategies": [
    "NUDGE_PULSE",
    "NO_CHANGE"
  ],
  "allowed_success_strategies": [],
  "ecrp_policy_version": "klein.ecrp_policy.v1",
  "max_attempts": 1,
  "mode": "ENVELOPE",
  "policy_id": "recovery-success-not-allowed",
  "requires_trace_evidence": true,
  "terminal_failure_required": true
}
